ReviewID,ReviewText,Source,Date
1,Amazing product! Exceeded my expectations.,Google Reviews,2025-05-20 17:09:50.920196
2,Fast delivery and excellent quality. Love it!,Amazon,2025-06-01 17:09:50.920196
3,Great value for money. Highly recommend this.,Google Reviews,2025-05-30 17:09:50.920196
4,"Fantastic experience, customer support was helpful.",Flipkart,2025-05-09 17:09:50.920196
5,"Very satisfied with my purchase, works perfectly.",Google Reviews,2025-06-22 17:09:50.920196
6,Loved it! Will definitely order again.,Flipkart,2025-07-20 17:09:50.920196
7,"Product is as described, very happy with it.",Amazon,2025-08-03 17:09:50.920196
8,"Awesome quality, great packaging, and quick shipping.",Flipkart,2025-05-24 17:09:50.920196
9,"Impressive service, everything arrived on time.",Google Reviews,2025-07-01 17:09:50.920196
10,"Outstanding performance, worth every penny.",Amazon,2025-05-17 17:09:50.920196
11,"Terrible experience, item arrived broken.",Flipkart,2025-06-12 17:09:50.920196
12,Worst product I’ve ever purchased.,Google Reviews,2025-05-06 17:09:50.920196
13,"Very poor quality, completely disappointed.",Amazon,2025-05-27 17:09:50.920196
14,Customer support was unhelpful and rude.,Amazon,2025-06-10 17:09:50.920196
15,Late delivery and item not as described.,Amazon,2025-06-12 17:09:50.920196
16,"Defective product, had to return it.",Amazon,2025-07-16 17:09:50.920196
17,"Horrible packaging, item was damaged.",Google Reviews,2025-05-10 17:09:50.920196
18,"Not worth the money, regret buying it.",Amazon,2025-05-13 17:09:50.920196
19,"Shipping took forever, very frustrating.",Google Reviews,2025-06-28 17:09:50.920196
20,"Extremely disappointed, will not buy again.",Amazon,2025-07-03 17:09:50.920196
21,"Product is okay, nothing special.",Google Reviews,2025-05-25 17:09:50.920196
22,"Average quality, meets basic expectations.",Amazon,2025-05-28 17:09:50.920196
23,It works fine but could be better.,Flipkart,2025-05-26 17:09:50.920196
24,"Neutral experience, not too good or bad.",Flipkart,2025-05-27 17:09:50.920196
25,"Just a regular item, nothing remarkable.",Flipkart,2025-07-06 17:09:50.920196
26,"Okay purchase, serves the purpose.",Amazon,2025-08-04 17:09:50.920196
27,Neither satisfied nor dissatisfied.,Amazon,2025-06-16 17:09:50.920196
28,"Decent product, but slightly overpriced.",Amazon,2025-07-23 17:09:50.920196
29,Acceptable quality for the price.,Flipkart,2025-05-25 17:09:50.920196
30,"Fine for temporary use, not long-term.",Google Reviews,2025-07-29 17:09:50.920196
31,Good product but packaging was terrible.,Flipkart,2025-05-29 17:09:50.920196
32,"Nice features, but a bit expensive.",Google Reviews,2025-07-03 17:09:50.920196
33,"Excellent build, but delivery was late.",Amazon,2025-06-09 17:09:50.920196
34,"Good for the price, but durability is questionable.",Google Reviews,2025-05-06 17:09:50.920196
35,"Loved the design, but customer service is slow.",Amazon,2025-05-06 17:09:50.920196
36,"Arrived quickly, but had minor scratches.",Amazon,2025-07-24 17:09:50.920196
37,"Super comfortable, but size runs small.",Google Reviews,2025-06-11 17:09:50.920196
38,"Very useful, but instructions were unclear.",Flipkart,2025-05-06 17:09:50.920196
39,"Pretty good, but not as expected from the brand.",Flipkart,2025-07-07 17:09:50.920196
40,"Great service, but the product color was off.",Google Reviews,2025-06-04 17:09:50.920196
41,"Fast shipping, product works fine.",Flipkart,2025-05-15 17:09:50.920196
42,"Mediocre experience, expected better.",Amazon,2025-07-17 17:09:50.920196
43,"Good packaging, average quality.",Flipkart,2025-06-20 17:09:50.920196
44,Nice product but missing some parts.,Flipkart,2025-07-24 17:09:50.920196
45,"Decent for the cost, but could improve.",Flipkart,2025-07-26 17:09:50.920196
46,"Not bad, but wouldn’t buy again.",Google Reviews,2025-06-26 17:09:50.920196
47,"Product okay, delivery disappointing.",Flipkart,2025-07-14 17:09:50.920196
48,"Happy overall, minor issues present.",Flipkart,2025-06-14 17:09:50.920196
49,"Reasonable price, average experience.",Google Reviews,2025-06-21 17:09:50.920196
50,"Positive overall, but not flawless.",Google Reviews,2025-07-11 17:09:50.920196
